<?xml version="1.0" encoding="utf-8"?>
<flights xmlns:xsi="http://www.w3.org/2001/XMLSchema-instance" xsi:noNamespaceSchemaLocation="aviation.xsd">

    <flight flightID="1">
        <departure-date>2012-12-13</departure-date>
        <departure-time>12:12:12</departure-time>
        <departure-point>Berlin</departure-point>
        <destination>Moskau</destination>
        <price>332.99</price>
        <passenger>
            <first-name>Leon</first-name>
            <last-name>Adelberg</last-name>
            <canceled>false</canceled>
        </passenger>
        <passenger>
            <first-name>Max</first-name>
            <last-name>Regenberg</last-name>
            <canceled>false</canceled>
        </passenger>
        <passenger>
            <first-name>Theo</first-name>
            <last-name>Regenberg</last-name>
            <canceled>false</canceled>
        </passenger>
    </flight>

    <flight flightID="2">
        <departure-date>2012-12-13</departure-date>
        <departure-time>12:12:12</departure-time>
        <departure-point>Berlin</departure-point>
        <destination>Moskau</destination>
        <price>332.99</price>
        <passenger>
            <first-name>Max</first-name>
            <last-name>Mustermann</last-name>
            <canceled>false</canceled>
        </passenger>
        <passenger>
            <first-name>Rene</first-name>
            <last-name>Altenburg</last-name>
            <canceled>false</canceled>
        </passenger>
        <passenger>
            <first-name>Martha</first-name>
            <last-name>Gluecklich</last-name>
            <canceled>false</canceled>
        </passenger>
    </flight>

</flights>

